technology;Finished a Codecademy course? Test your skills with a classic brain-teaser often asked in developer job interviews!
technology;"There aren’t many people my age in the same position without a college degree, but in tech, it’s possible." http://trhou.se/2vf3bv4 
news;Proof that workers want to relinquish their menial jobs to chatbots: https://venturebeat.com/2017/08/01/heres-proof-that-workers-want-to-relinquish-their-menial-jobs-to-chatbots/ …
news;Sony and IBM stuffed 330TB into a palm-sized cartridge http://tnw.me/Ug53EzE 
news;LG confirms its next smartphone will feature a massive six-inch OLED screen http://tcrn.ch/2vkPScP  by @jonrussell
news;Lunar nanobots could bring gaming to the moon http://cnet.co/2wob52w 
news;Mystro helps new Uber drivers learn how to optimize the system
news;US scientists used Crispr to fix a gene in human embryos for the first time. It worked—but not like they expected
news;Ikea is selling solar batteries in the UK http://cnet.co/2vkIcXY  @IKEAUK
news;SIGMA #accelerator from @Zinnov and GIZ aims to give social enterprises a hand in #scalingup LAST DAY to apply Aug4
news;Facebook has its own Amazon Echo in the works. https://venturebeat.com/2017/08/01/facebook-is-reportedly-developing-a-video-chat-device-and-smart-speaker/ …
news;Hyperloop One’s next step is to test airlocks for pod entry and exit http://tcrn.ch/2uWCWcp 
news;Mac vs Windows: Why it doesn’t matter so much anymore http://tnw.me/TkQsUwi
news;Meadow is the Amazon of weed http://tcrn.ch/2uVXHoi 
news;The LG V30 could have one less screen than the V20 http://cnet.co/2wnO53N 
news;Two secret #Windows10 buttons you need to know http://cnet.co/2v1BbJ9  @Windows
travel;Have you traveled by van? 🚐
travel;Stairway to heaven #mawibeach #lombok #indonesia
travel;LP Local Vesna Celebic explains why she loves her city - stunning #Dubrovnik! http://lptravel.to/Zda8Dv  @Dubrovnikguided
travel;Air France passenger boards wrong flight, goes to sleep and wakes up in a different country http://cntrvlr.co/DeS2nWv 
travel;From the wetlands of Ōsaki to the marine life of Cuba, journey the globe with these fresh, award-winning photos
travel;Tea time at the dunes! http://buff.ly/2tvqJfx  @Wolwedans_NAM #desert #travel
travel;MT @Go2MattPhillips: WARNING! Pickpockets! Charges pending for trying to steal the Stawamus Chief's show. Entertaining munchkins #lpincanada
travel;Why your next family vacation should be on a cruise http://cntrvlr.co/Xc3JfaR
travel;I walked in a barley field drinking #Manitoba lager with its makers (Neepawa's @FarmeryBrewery). They welcome you to drink in their fields.
travel;One of the best ways to get to know the local culture of a city? Pay attention to the street art.
travel;Love this award-winning photo of the buff-tailed coronet in Ecuador? Take in a stunning look at hummingbird flight: http://on.natgeo.com/2v0tG5j
travel;Tracking the Real Snow White in Bad Wildungen Germany https://landlopers.com/2016/08/16/bad-wildungen … #Germanytravel #germany #europe
travel;Experience the best of #Vancouver for free: http://lptravel.to/AaVFfE  by @johnleewriter #travel #Canada
travel;10 movies that immortalize Colorado http://ift.tt/2u1iofT 
technology;What we’ve learned from .NET Core SDK Telemetry @runfaster2000 @dotnet
technology;Get started with Firebase authentication for iOS.
technology;What is #Python (the programming language created in the late 1980s and named after Monty Python) used for? http://trhou.se/2tpFksH
technology;Run Lambda functions globally with Lambda@Edge, now available to all customers: http://amzn.to/2vuZbHV 
technology;Learn how to monitor & track your cloud resources with this video by cloud expert @janakiramm
technology;Learn how Bandwidth built a text-to-speech application into their communications offerings with Amazon Polly. http://amzn.to/2vv5wTF
technology;Speed up DynamoDB response times from milliseconds to microseconds without application rewrite. http://amzn.to/2vuORj9 
technology;New on the #AI Blog: Exploiting the Unique Features of the Apache MXNet Deep Learning Framework with a Cheat Sheet. http://amzn.to/2vuMlcB 
technology;Learn how to run common data science packages on Anaconda and Oozie with Amazon EMR. http://amzn.to/2vukSaR 
technology;Learn how these #nonprofits speed time to cure in our recent blog post: http://amzn.to/2wnfeUv 
technology;Learn how to simplify your security management and establish endpoint protection on AWS. http://amzn.to/2wn9KZB 
technology;This is My Architecture: @Ocado builds secure, loosely coupled microsvcs using Route53,Elastic Beanstalk & DynamoDB http://amzn.to/2ulpvPA 
technology;Learn how to switch your security strategy when burdened with poor tooling in our webinar. http://amzn.to/2vusLgx 
technology;Use Amazon Cloud Directory to build & run applications that need HIPAA & PCI compliance in the AWS Cloud! http://amzn.to/2wmUDzw 
news;Germany is now one of few countries that bans workplace keylogging http://tnw.me/lx4pmzx 
news;Why Android O has us more excited than #iOS11 http://cnet.co/2vuXYjA
news;Tesla's stock charges up thanks to Model 3 demand and higher revenue
news;Whatever makes you feel better about @Apple kowtowing to Chinese censorship, Mr. Cook. https://venturebeat.com/2017/08/02/apple-ceo-cook-defends-move-to-censor-chinese-apps/ …
news;Here are the best startup cities in the Midwest http://tcrn.ch/2uVNtEq 
news;Smart belt helps Parkinson's patients, elderly with balance http://cnet.co/2wnQgEr 
news;Samsung launches a ginormous 88-inch TV that costs $20,000 http://tnw.me/Aai4BYr
news;SpaceX helped Tesla with a huge headache in its cars http://tcrn.ch/2w87O7Z 
news;Hackers take control of large outdoor screen in Cardiff to broadcast offensive messages http://tnw.me/QBeuFaG 
news;Bootstrapped @3dot14digital is putting #companies on the #digital path https://yourstory.com/2017/08/bootstrapped-3-14-digital/?utm_source=Twitter&utm_medium=Post …
news;Can @Facebook Workplace crush Slack and Microsoft Teams beneath its blue heel? https://venturebeat.com/2017/08/01/facebooks-plan-to-convince-businesses-workplace-beats-slack-and-microsoft-teams/ …
news;Study shows VR programming skill is at the top of employer wishlists http://tnw.me/YDfDywH 
news;Square continues its stellar stock market run http://tcrn.ch/2w817CX 
news;Kuri is watching you. Kuri knows your face. https://venturebeat.com/2017/08/01/the-kuri-home-robot-will-use-facial-recognition-to-record-video/ …
travel;“It is better to travel than to arrive.” – Buddha.
travel;Where to go in September for relaxation http://lptravel.to/S2QkGk  #travel
travel;You can have a beer while standing in Slovenia and Croatia at the same time http://cntrvlr.co/cYxxVSr 
travel;via @OttsWorld Why Would Someone Live in the Canadian Arctic?: https://www.ottsworld.com/blogs/why-would-someone-live-canadian-arctic-inuvik/ … … #Travel #Canada
travel;Today, just two years ago, I completely changed my life. I took a risk and quit my job. A stable, reliable job, wi… http://ift.tt/2u5WKLz 
travel;via @BrendanVanSon OK Norway, I Get it You’re Beautiful...: http://www.brendansadventures.com/ok-norway-i-get-it-youre-beautiful-photos-of-norway/ … … #Travel #Norway
travel;"Being in the middle of the desert emphasizes how tiny a footprint humans leave on this Earth."
travel;Want a chance to win a trip for two to Asia? http://lptravel.to/best-in-asia-comp … #travel #BestinAsia
travel;The world’s longest pedestrian suspension bridge just opened in the Swiss Alps http://cntrvlr.co/e3q3C3y 
travel;How can you resist the white-sand beaches, top-notch surf and beautiful coral reefs of the Maldives?
travel;I wish I was back in #Timisoara starting the day with a fresh minty lemonade. Seriously, this stuff is better than coffee! #THinTimisoara
travel;25 restaurants worth travelling across the globe for - according to @OpenTable http://buff.ly/2w99gaz 
travel;The reluctant Airbnb host: why I rent my spare bedroom to pay my own rent
travel;A7 - The Balinese Hindu New Year celebration, Nyepi, is unlike any other holiday in the world! http://ow.ly/SX8S30e5iVF  #CheapOairChat
technology;Migrate your databases to Amazon Aurora. Up to 5x the performance at 1/10th the cost! http://amzn.to/2vuarEq 
technology;@Azure’s CLI 2.0 can be used directly in browser, or it can be installed on macOS, Linux, and Windows. https://docs.microsoft.com/en-us/cli/azure/get-started-with-azure-cli …
technology;Learn how @UW is using @Azure & #opensource technologies to predict ocean chemistry http://msft.social/hvAyJs  #Python #Django
technology;Accelerate the development of deep learning applications on the cloud with Apache MXNet and @AWScloud. http://amzn.to/2wmOt2r 
technology;Hear from #cloudcomputing thought leaders such as @adrianco & @mza during the #AWSSummit New York City keynote! http://amzn.to/2vu7OT0 
technology;Deploy a data lake foundation in the AWS Cloud in 20 minutes with our new Quick Start! http://amzn.to/2wmEVUS 
technology;When should you start exploring #BigData solutions? Read here: http://trhou.se/2vmLQBg  via @medium by @craigsdennis
technology;https://github.com/kagux/ex_debug_toolbar … looks really cool
technology;We're excited to announce a series of performance optimizations supporting #Linux & #Windows. Read more
technology;in the case of the env variable, is there a way to confirm Ruby is using jemalloc?
technology;Time zones in PostgreSQL, Elixir and Phoenix http://elixirstatus.com/=sKRH  /cc @elixirweekly #elixirlang
technology;Quickly build & launch your own deep learning project using Apache MXNet on AWS. http://amzn.to/2vtaPTp
technology;Building a serverless web app means no servers, easy scaling, & no idle charges. Get started now!
technology;Make the best decisions for your business in #cloud, #data & #security. Get the Business Model Innovation Guide: http://msft.social/Hz3avL
news;How you can get through a job you don’t like. #selfhelp #jobsatisfaction #career #work https://yourstory.com/2017/05/get-through-hateful-job/?utm_source=FB&utm_medium=Post …
news;Apple left clues for the next iPhone in its earnings report http://cnet.co/2vuKfcO 
news;Small business loan platform Kabbage nabs $250M from Softbank http://tcrn.ch/2faFspS  by @ingridlunden
news;God help us all, Mark Zuckerberg has hired Hillary Clinton's chief strategist
news;This association with @MobiKwik also marks the #payment company’s entrance into the credit lending space. #funding https://yourstory.com/2017/08/mobikwik-raises-rs-225cr-bajaj-finance-launch-first-lending-product/?utm_source=Twitter&utm_medium=Post …
news;Twitter explains why it won’t disclose the number of daily users. Kinda. https://venturebeat.com/2017/08/02/twitter-explains-why-it-wont-disclose-the-number-of-daily-users-kinda/ …
news;Dreams don’t die, they just sleep awhile, so is the story of these youngsters. #startup #bengaluru #entrepreneur https://yourstory.com/2017/08/moving-to-bengaluru-boriya-bistar-starter-kit/?utm_source=Twitter&utm_medium=Post …
news;The #middleclass #upbringing does something brilliant: it makes you a cockroach instead of a unicorn
news;A great read: America's youngest billionaire has retired and is now spending his money trying to fix scientific dat…
news;How to survive having an iPhone with only 16GB of storage http://cnet.co/2wof4fk 
news;YouTube unleashes Google AI to crack down on extremist content http://tnw.me/7qIHjIT 
news;A #tea #cafe in Bhopal 'Chai34' is popular for selling 22 varieties of tea. #startup #entrepreneur. https://yourstory.com/2017/08/madhur-malhotra-chai-34-tea-engineer-cafe/?utm_source=FB&utm_medium=Post …
news;Immigrating to the U.S.? These tech services can help http://tnw.me/ughYB9D 
news;Here's what Faraday Future learned from its sprint up Pikes Peak http://cnet.co/2wnYcVZ 
travel;Simple Italy Itinerary: Ideas for Planning One Week in Italy
travel;What a difference a few days makes. This was me on Sunday in #Timisoara. I'm now wrapped up warm and working in my kitchen #THinTimisoara
travel;LP Pathfinders: top Instagrams from July 2017 http://ift.tt/2uZlC6n 
travel;RT @LPtravelnews: #Queensland will soon be home to the world's longest 'electric highway' http://lptravel.to/AQhJaH 
travel;Get a glimpse of what life is like in North Korea, a country rarely seen by foreigners
travel;My Iceland Ring Road Itinerary https://www.bloglovin.com/blogs/wild-junket-4009607/my-iceland-ring-road-itinerary-5788586351 … on @bloglovin
travel;Tips for tech trouble at the airport http://ift.tt/2vvwCKl 
travel;5 tips for sleeping in an airport http://cntrvlr.co/4OAllge
travel;Waking at 530am is hard. But sometimes worth it. #manitoba
travel;How a young woman from Finland became a student of an Iranian master horseback archer
travel;Loving the famous maple syrup pancakes @SugarMoonFarm - so so good #visitnovascotia
travel;Today we caught up with @2WanderingSoles to talk about ethical travel! 
travel;Photo Series: Beautiful European Cities You May Not Know https://landlopers.com/2016/03/03/photo-series-european-cities … #travel #lp #Europe
travel;Have your August getaway planned yet? Here are some great ideas: http://bit.ly/2a8EvG8#WheretoGo … #summervacation
technology;Do you have any questions about @elixirlang? Let us know! Beginner or advanced, we don't care. Will reply to all questions. #myelixirstatus
technology;3 misunderstandings about #code review that are probably slowing you down: http://trhou.se/2l8WD9F  by Nic Hampton
technology;Codecademy adds new intensive options to help beginners learn code quicker http://tnw.me/8A2r3Z3 
technology;"There is much more innovation ahead." GA Co-Founder and CEO @jakeschwartz discusses what the future of GA holds:
technology;Attending a #conference in the next few months? Here are 8 ways to get the most out of it: http://trhou.se/2js5Cpg  by @SmashDev
technology;“How Young Professionals Can Keep From Burning Out” by Thrive Global:
technology;Don't miss informative breakouts like "Expert Mentoring" and "Creating a Culture of Innovation" at #PluralsightLIVE: http://plrsig.ht/2gR7qrb Creating a Culture of InnovationCreating a Culture of Innovation
technology;Tip No. 5 for reducing stress at work: Try guided meditation, on your own or with an app. 8 more tips: http://ga.co/2v79bWy 
technology;Adding Drag And Drop To React @franzejr http://buff.ly/2vQDDT1
technology;6 Go Tips You Should (probably not) Use - You may not use the tips, but you’ll learn some Go
technology;"We use online learning as an element of everything we do & see a blended model as the future of all @GA programs"
technology;Why Is Ruby Multithreading Slow? https://medium.com/@dathanbennett/why-is-ruby-multithreading-slow-96afb475f669 … (Spoiler: It isn't.)
technology;Hey folks, I'm looking for a recommendation on a Postgres book. Anyone have a favorite?
technology;Which open source libraries /  frameworks are you most excited about looking into the future?
news;Incredibly well-preserved fossil changes our understanding of armored dinosaurs http://gizmo.do/cDZ7fgC 
news;Looks like the issue of those surprise Comcast fees may end up in court
news;Samsung Is Keeping the Joy of Flip Phones Alive
news;Fitbit is planning a new smartwatch for the holidays ... if it lives that long https://wp.me/p8wLEc-9tWa  by @obrien
news;Private Valuations Aren't Grounded in Reality, Study Finds http://bit.ly/2vsWHbT 
news;Facebook finishes its move to neural machine translation http://tcrn.ch/2uo5vf6  by @JohnMannes
news;Curious about Tesla's unique Model 3 in-car UI? Check out this mock-up http://tcrn.ch/2uo7KPo  by @etherington
news;Clarence Thomas’ legal vision is becoming a Trump-era reality.
news;After phishing attacks, Chrome extensions push adware to millions http://arstechnica.com/information-technology/2017/08/after-phishing-attacks-chrome-extensions-push-adware-to-millions/ … by @dangoodin001
news;Another black activist, Ijeoma Oluo, is suspended by Facebook for posting about racism
news;Blogs got chopped up and turned into corners of huge multi-billion dollar tech empires
news;These are the smallest and lightest of the tiny tablets http://cnet.co/2v2MqRA 
news;With the right gear, your smartphone will be able to take some stellar photos of the August 21 eclipse
news;This website intends to document press freedom violations in a place that hasn't historically required it: America
travel;From pristine forests to rare wildlife habitats, these destinations top the list of new must-see UNESCO sites http://on.natgeo.com/2u7UnI0
travel;Why I wish I'd traveled less http://ift.tt/2vwluN6 
travel;Q1 Best city, state or destination for summer deals? #TravelSkills
travel;Love at first bite: our unforgettable meals from the road http://lptravel.to/0Ickbt  #travel
travel;[WATCH] Spotlight on Hawaii's volcanoes http://lptravel.to/JwOVHq  #travel
travel;The cost of 2 nights in Copenhagen, Denmark http://rviv.ly/KI2JH  #oldpost
travel;The best sopping in NYC http://ift.tt/2unDzI7 
travel;A guide to Positano’s quiet side http://cntrvlr.co/aoHX0vS 
travel;Japan’s coolest design company is opening an ultra-minimalist hotel https://landlopers.com/2017/08/02/travel-news-august-3-2017 … #travel #news
travel;What isn't? -- What’s the Matter With Lonely Planet? https://www.nomadicmatt.com/travel-blogs/lonely-planet/ … via @nomadicmatt
travel;“We travel, initially, to lose ourselves and we travel, next to find ourselves.” - Pico Iyer.
travel;The @TataBrew company is a very very cool place plus they make a beer where $ goes to dog rescue! #visitnovascotia
travel;My travel journal from a long weekend in Timisoara, Romania https://www.bloglovin.com/blogs/travel-hack-3968071/my-travel-journal-from-a-long-weekend-in-5789214479 … on @bloglovin
travel;A one day guide to 15 UK National Pa http://ift.tt/2unHyV9 
technology;How to install and configure @goforcd, a powerful CI/CD platform designed to automate testing and release processes http://do.co/2fc16u1
technology;Run complex queries on unified data inside and outside your data warehouse. Amazon Redshift Spectrum. http://amzn.to/2vweHmR
technology;Amazon Redshift analyzes your data and suggests the most effective data compression. http://amzn.to/2vwk9WC 
technology;Set it and forget it: Auto Scaling adjusts EC2 instances as needed to maintain your targets. See how at
technology;Hear how to avoid capacity imbalance and overload in service to service communication: http://amzn.to/2vwcnMv
technology;Get an introduction to Microservices with AWS Lambda, API Gateway & more at the #AWSLoft NY! #devops http://amzn.to/2wbAjkI 
technology;Do you have any questions about Elixir? Let DailyDrip know! http://elixirstatus.com/=iqPO  /cc @elixirweekly #elixirlang
technology;A really ❤ my first #ElixirEdinburgh #meetup. #elixir #elixirlang #elixirstatus #myelixirstatus #developers
technology;"Time zones in PostgreSQL, Elixir and Phoenix" - my new blog post: https://www.amberbit.com/blog/2017/8/3/time-zones-in-postgresql-elixir-and-phoenix/ … #myelixirstatus #elixirlang #elixir #postgresql
technology;Lessons From Using Phoenix 1.3 https://robots.thoughtbot.com/lessons-from-using-phoenix-1-3 … #elixirlang #myelixirstatus via @bigardone
technology;Looking for elixir developers in Poland https://jobs.recruitee.com/o/elixir--phoenix-backend-developer … #myelixirstatus
technology;Join #elixirlang community in 2 weeks for #ElixirLDN 17 August, last minute tickets still available. #myelixirstatus http://ow.ly/m7p330e8jXj 
technology;“National Health Service, on Elixir and Kubernetes” by @andrew_dryga #myelixirstatus #elixir #kubernetes #erlang
technology;We are open sourcing our Phoenix deployment process with Ansible playbooks for Elixir http://blog.lunarlogic.io/phoenix-app-deployment-with-ansible-playbooks-for-elixir … @elixirlang @elixirphoenix
news;Bozoma Saint John to talk about transforming Uber at Disrupt SF http://tcrn.ch/2wpe76B  by @meganrosedickey  #TCDisrupt
news;Heptio launches two new open source projects that make using Kubernetes easier http://tcrn.ch/2vm4VTG  by @fredericl
news;Disney launching a way to "see, hear and smell" the #StarWars universe this fall http://cnet.co/2vlWI1Z 
news;#AI, machine learning to impact #workplace practices in India: @Adobe https://yourstory.com/2017/08/workplace-ai-machine-learning-impact-india-adobe/?utm_source=Twitter&utm_medium=Post …
news;Thousands Show Up For Jobs at Amazon Warehouses in US Cities http://bit.ly/2u4azGi 
news;Why NASA will test its asteroid defense system this October http://gizmo.do/5YgfErH 
news;#WannaCry hackers walk away with $140,000 http://cnet.co/2vlOtTi 
news;20 bots that can help you build your #startup https://wp.me/p8wLEc-9tND  by @kharijohnson
news;Hope ads aren't making your site chug: @Facebook News Feed now favors fast-loading stories just like Google. https://venturebeat.com/2017/08/02/following-in-googles-footsteps-facebook-tweaks-its-mobile-news-feed-to-show-more-fast-loading-stories/ …
news;Boeing Dreamliner jet's self-portrait flight spans the entire US http://cnet.co/2wqk6rU 
news;@badassboz to talk about transforming Uber at Disrupt SF http://tcrn.ch/2wabNkx  #TCDisrupt
news;The true birthplace of Silicon Valley: https://www.facebook.com/RobertScoble/posts/10155572525709655 …
news;The 3 easiest ways to back up your files http://cnet.co/2wqBtsL 
news;This plane is attempting to go into the stratosphere—with no motor: http://trib.al/dn6F4QT 
travel;Hmm, will it be #China, #India or #SriLanka? Win a trip for two to an Asian destination: http://lptravel.to/best-in-asia-comp … #travel #BestinAsia
travel;The world’s longest pedestrian suspension bridge just opened in the Swiss Alps http://cntrvlr.co/tYSn4dl
travel;MT @lpkids: Ever considered the Maldives for a family trip? Read about @TravelBabbo 's experiences http://lptravel.to/ONSjDG 
travel;This is the best hotel in EVERY state http://cntrvlr.co/P3kvhT5 
travel;As temps soar, 96 fountains at the base of the Unisphere help visitors beat the heat in this long-exposure shot
travel;Girlfriends + Vegas = perfect way to start the new year! http://buff.ly/2vq7W56  #NYE
travel;Colorful UNESCO Town of Lunenburg, Nova Scotia [PHOTO] https://landlopers.com/2017/08/02/photo-lunenburg … #VisitNovaScotia   #Canada #Lunenburg
travel;7 Magnificent reasons to visit Conwy http://rviv.ly/pCv4r  #oldpost
travel;Via @LPtraveltravel: #Buffalo's new Hotel Henry opens in abandoned asylum http://lptravel.to/9YJaVJ  #travel
travel;enice asks tourists not to pause too long on bridges http://cntrvlr.co/0vXpa7m
travel;New Post: My First Date With Martin Luther in Wittenberg, Germany https://landlopers.com/2017/08/02/wittenberg … #GermanyTourism  #Wittenberg #lutherCountry
travel;Counting down to a complete travel blog redesign ... say good bye to the old design ... only 1 or 2 more days to go! Thanks to @rtwlabs :)
travel;From the pyramids to the Nile River, don't miss these stunning scenes from Egypt captured by our #YourShot community
travel;This is the best new restaurant neighborhood in L.A. http://cntrvlr.co/ABSt9Sd 
technology;Top 5 Tips for Learning: http://trhou.se/2rarfxV  by @sketchings via @treehouse_blog #tips #learning
technology;Why Every City is a "Tech City" http://trhou.se/2q8LF9H  by @EmSchw
technology;We launched Codecademy Pro today.  The best part?  The user stories from our users are inspiring.
technology;It's important to keep your data and communications #secure. Lear how in Intro to Data Security w/ @kennethlove: http://trhou.se/2qWXayd 
technology;"The most important thing is to never to stop dreaming. Tech is the future, so invest in yourself & the knowledge." http://trhou.se/2vf3bv4 
technology;"Aim for wide, not narrow." Why #IT teams are more flexible and innovative with a diverse skill set: http://plrsig.ht/2tf7AOx 
technology;Integrating React in a Chat Phoenix App - https://buff.ly/2u5Fr9h  #react #phoenix
technology;@zsims's thoughts on Codecademy Pro on @ProductHunt https://www.producthunt.com/posts/codecademy-pro-2#comment-503912 …
technology;Tonight we're happy to welcome high school and college women from #BUILTBYGIRLS to GA HQ to learn about pursuing careers in tech.
technology;When I wrote Exercises for Programmers, this is what I hoped to see. So cool.
technology;Learn how to code this summer with @Codecademy
technology;Have you tried our mentoring feature? If not, now's the time to give it a shot. Learn how to connect with an expert: http://plrsig.ht/2tf4rye 
technology;@Codecademy’s @zsims: There’s a gap in the economy between technologically literate employees & what educational institutions are teaching.
technology;Product designers, here's how to ace your next whiteboard challenge: http://ga.co/2vQWf4W  via @BlakeHudelson @prototyprIO
news;Crunch Report Virtual Reality Star Wars Experience Is Coming to Disney Parks http://tcrn.ch/2v1CGZm  by @titoyooo
news;A new set of open-source SS7 solutions makes fixes to a long-ignored cell network flaw available to all
news;Why you’ll be hooked after seeing the total solar eclipse http://cnet.co/2wqEJE9 
news;Here are your Samsung #GalaxyNote8 specs. https://venturebeat.com/2017/08/02/samsung-galaxy-note8-final-specs/ …
news;Facebook begins testing Stories on the desktop http://tcrn.ch/2wahm2x 
news;The alt-right goes panhandling http://gizmo.do/2KbVHme 
news;@FishChain casts net wide to bring #customers fresh #seafood and benefit #fishing communities https://yourstory.com/2017/08/fish-chain-startup-fresh-seafood-benefit-fishing-communities/?utm_source=Twitter&utm_medium=Post …
news;Good hackers can do bad things, too
news;Why is @Apple's Services business is booming? https://venturebeat.com/2017/08/02/heres-why-apple-says-its-services-business-is-booming/ …
news;NotPetya Ransomware Victims Preparing Lawsuit Against Ukrainian Software Firm http://bit.ly/2v1wWPh 
