news;8bitdo’s new Nintendo Switch-compatible NES30 Arcade Stick now on sale http://tcrn.ch/2wa0gSx 
news;Amazon employs 45,000 robots, but they all have something missing: hands. That may soon change
news;PC Gaming Weekly: Survival evolved https://wp.me/p8wLEc-9tV9  by @jason_wilson
news;Etsy lives to fight another day as new leadership shaves costs and delivers an earnings beat
travel;5 Not To Miss Spots on a Central Newfoundland Road Trip https://landlopers.com/2016/08/14/central-newfoundland … #NLTweets #ExploreCanada #travel
travel;The Rhode Island beach destination you need to know about http://cntrvlr.co/2WsY4Ru
travel;4 surprising things you can only learn by traveling solo via @iamwellandgood
travel;"I'm a dreamer. I have to dream & reach for the stars, & if I miss a star then I grab a handful of clouds." - Mike Tyson.
travel;Fab article from @GoGoGoyanes in @NatGeo about 3 women travel guides in India with @Intrepid_Travel #IncredibleIndia #girlpower
travel;via @LiveShareTravel Deserts, Ruins and Luxury Abound: Places to Visit in Jordan: http://livesharetravel.com/27901/places-to-visit-in-jordan-road-trip/ … … #Travel #Jordan
travel;Ocean or sand dunes? Big decisions to make when staying at the @Anantara_Hotels in Bazaruto http://buff.ly/2tCqkIc  #island #tropical
travel;Get lost in a sea of stunning scenes with @LonelyPlanet's "Travel Photography" mag http://flip.it/DxhplE   #MagsWeLove #FlipTravel
travel;In a city lit up by neon shopping strips, about 200,000 people live in these tiny "coffin-like" apartments
travel;Who's ready for football season? 🏈 Check out iconic tailgating foods in every state to get you even more excited --> http://bit.ly/2wqeYUB
travel;The best new floating hotels http://cntrvlr.co/UWvAwcL
travel;A fruit sorter removes blemished melons from a market near Hyderabad, India via #YourShot #NationalWatermelonDay http://on.natgeo.com/2vmM9eM
travel;Where to take your date in Atlanta http://ift.tt/2fcJ1Mf 
travel;Via @TODAYshow: 8 of the most under-the-radar travel spots in the US http://on.today.com/2hqQx70 
technology;Stream over, I'll upload later. TL:DR I think I shaved ~25% off the Rails TechEmpower bench, could maybe shave another ~25% off
technology;NOW STREAMING: Trying to make TechEmpower's Rails benchmark even faster
technology;Looking at latency #'s https://www.techempower.com/benchmarks/previews/round15/#section=data-r15&hw=ph&test=json … here, the latest round reflects my experience w/Rails. additional ~8 ms overhead v Roda
technology;Turns out, using all the available CPU resources improves throughput. Who'da thunk.
technology;And, to no one's surprise, Rails is doing ~5-700% better on the next round of TechEmpower benchmarks
technology;Rails 5.1.3 is done! Thanks for the help with finding regressions and fixes 
technology;http://send.firefox.com  = private, encrypted, self-destructing file sharing up to 1GB
technology;New blog post in the Rust modules series!
technology;whoah, red hat is writing a filesystem thingy in #rustlang https://phoronix.com/scan.php?page=news_item&px=Stratis-Red-Hat-Project …
technology;Rust RFC 2094: Non-lexical lifetimes https://github.com/rust-lang/rfcs/pull/2094 
technology;Elixir helped me realize I’m not #TooDumbForFP #kcdc2017 #MyElixirStatus
technology;Prompt Mix env on IEX (with colors) https://gist.github.com/fertapric/15e88de17d12558b65be7966fbdf31c0 … #elixir #ElixirLang #iex #myelixirstatus
technology;Unlearning old habits might easily be the toughest and the funniest part of switching from #Ruby to #ElixirLang & #otp. #myelixirstatus
technology;Reducing Elixir Backend Time From 120ms to 20ms With Parallelization http://buff.ly/2wnEsC6  #elixirlang #myelixirstatus
news;A little more Minecraft is coming for you #NintendoSwitch lovers: https://venturebeat.com/2017/08/02/nintendo-switch-gets-minecraft-story-modes-first-season-on-august-22/ …
news;YC-backed Muzmatch definitely doesn’t want to be Tinder for Muslims http://tcrn.ch/2v0mGHm 
news;The WannaCry ransomware attackers are cashing out their bitcoin at a dangerous time
news;Need a second opinion? OpinionX brings you #doctors on a #digital platform. #DigitalHealth https://yourstory.com/2017/08/opinionx-doctors-second-opinion/?utm_source=Twitter&utm_medium=Post …
news;Intel's Upcoming Coffee Lake CPUs Won't Work With Today's Motherboards http://bit.ly/2v1QRhi 
news;'Alexa, play music for getting pumped' http://cnet.co/2wqr4x0 
news;Stephen King’s Tower, Steven Soderbergh’s return, and 27 other movies coming in August http://trib.al/MAM2Zrp 
news;Uber Freight expands to multiple new markets and adds new features http://tcrn.ch/2uZSLii 
news;20 things you should never, ever Google http://cnet.co/2vxLWGe 
news;Surprise: Brands post more stories on Instagram than Snapchat http://tnw.me/8QdVzz9 
news;Everyone agrees that secure elections matter securing them is another matter entirely
news;Uber Knowingly Leased Unsafe Cars To Drivers, Says Report http://bit.ly/2vuIlrJ 
news;Marketers are worried that automation will claim their jobs says @kununu_us.  https://venturebeat.com/2017/08/02/kununu-marketers-are-worried-that-automation-will-claim-their-jobs/ …
news;Need a new password? Here's 306 million to avoid http://cnet.co/2v3IP5O 
travel;Chill out at these cool museums. ❄️
travel;Still 2 days left to enter this week’s IG photo contest sponsored by @PayPal! More info here: http://ow.ly/XYtd30e5mpB 
travel;REALLY impressed by how well represented Pride is here in  @VisitNovaScotia - I've seen rainbow flags everywhere  :) #visitnovascotia
travel;8 ways to easily avoid the crowds in Alaska http://cntrvlr.co/ocHeE9E 
travel;Exodus Travels Land of the Tiger tour of India http://breathedreamgo.com/2017/02/exodus-travels-land-of-the-tiger-tour-of-india/?utm_source=ReviveOldPost&utm_medium=social&utm_campaign=ReviveOldPost … #lp #NGTradar #TTOT #solotravel
travel;This is the best champagne served on flights http://cntrvlr.co/R2n3vUd 
travel;New Post: My First Date With Martin Luther in Wittenberg, Germany https://landlopers.com/2017/08/02/wittenberg … #GermanyTourism #Germany   #lutherCountry
travel;A selection of photographs to inspire the nature photographer in you
travel;What NOT to Pack in Your Carry-On Bag https://travel-made-simple.com/what-not-to-pack-in-your-carry-on-bag/ … #packingtips #traveltips
travel;A perfect day on O'ahu’s North Shore: http://lptravel.to/jSfqnG  #travel #Hawaii
travel;Meet our new app: Trips. Upload + share the best moments from your latest adventures: http://lptravel.to/TripsApp  #lptrips w/ @unsplash
travel;Andrew Adams: Indian wedding magic https://breathedreamgo.com/andrew-adams/?utm_source=ReviveOldPost&utm_medium=social&utm_campaign=ReviveOldPost … #lp #NGTradar #TTOT #solotravel
travel;Exploring West #Australia’s craft #beer scene http://lptravel.to/dyqgYO  by @travelwriterNZ #travel
travel;New Post: Learning to Appreciate the Bauhaus in Dessau, Germany https://landlopers.com/2017/08/08/bauhaus … #travel #Lp #GermanyTourism #Design
technology;Ruby 2.4 Avoids Exception for Integer#dup
technology;What is the primary purpose of code reviews in a closed-source, business-app context?
technology;Name a C codebase of 1000 lines or less that would be a good example for a beginner to read and study. #lazyweb
technology;Yeah, don't say the name eh 🤣 security through obscurity!
technology;Reminder to everyone on Rails 4.2: you are now running an version of Rails which now only receives severe security patches.
technology;Is there any place with writeups onhow components of @servo get integrated into Firefox? I think it's very interesting, engineering-wise.
technology;Cleaning Up Path Definitions with __dir__: https://bogdanvlviv.github.io/posts/ruby/with-__dir__-we-can-restore-order-in-the-universe.html … (It's been available since Ruby 2.0.)
technology;Would it be possible to pipe a download of a SQL backup straight into psql?
technology;hy Hanami Will Never Unseat Rails: http://boffinism.com/why-hanami-will-never-unseat-rails/ …
technology;How learning Elixr made me better Ruby developer: http://www.rubyflow.com/p/8jpo2g-how-learning-elixr-made-me-better-ruby-developer …
technology;I still printf and try again like the day my first code compiled
technology;I really like Github's Pulse view, find myself using it all the time.
technology;also worth a repost: @birgitta410 's delve into the frustrating history of the image of programmers
technology;Unsupervised Learning Using K-means Clustering in Ruby
news;Glint is a stealthy London fintech startup that promises to turn gold into a 'new global currency' http://tcrn.ch/2vlU9Mn  by @sohear
news;This site lists all the countries you can travel to without a visa http://tnw.me/ApQRjVP
news;Nextdoor turns to real estate listings for monetization
news;Listen up @Facebook, @HTCVive and @PlayStation: VR can be a mainstream tech — but it’s not ready yet. https://venturebeat.com/2017/08/08/vr-can-be-a-mainstream-tech-but-its-not-ready-yet/ …
news;#Mumbai-based #startup @TailoreMade is bringing the #designer to your doorstep. #startups #designerwear #fashion https://yourstory.com/2017/08/tailoremade-statup-app-tailoring-service/?utm_source=TW&utm_medium=Post …
news;This small but rugged Chromebook won't hurt your wallet http://cnet.co/2wKsClE 
news;#GameofThrones hackers allegedly tried tricking HBO with altered document http://cnet.co/2wKryy8 
news;500 Startups' Australia accelerator program is axed by its partner before it even launched http://tcrn.ch/2fvkbrc  by @jonrussell
news;The Trump administration has urged the USDA to use the term "weather extremes" instead
news;AWS just proved why standards drive technology platforms
news;Maven to expand on-demand short-term Gig rentals to 6 more U․S․ cities http://tcrn.ch/2us10kE  by @etherington
news;Bollywood production houses ordered the Internet Archive to be blocked across India http://tnw.me/dM4nX2e 
news;Facebook launches original video content in redesigned Watch tab
news;How the internet is shaping our collective memory - for better or for worse http://tnw.me/xKORy2W 
travel;Take a peek behind the 'zines of September's @LPTraveller mag http://lptravel.to/iZ1hs1   #travel
travel;RT @atlasandboots: Sri Lanka: From Coast to Countryside – our latest story on @lonelyplanet's Trips app! http://trips.lonelyplanet.com/s/tHG2rQ  #lptrips
travel;Secret marvels: eyewitnesses of the weird and wonderful http://lptravel.to/YEczfw  #travel
travel;10 destinations that prove water makes you happy http://cntrvlr.co/prdGhjz 
travel;You don't have to just rely on your piggy bank to save your money for traveling...http://buff.ly/2uleKhL 
travel;MT @lptravelnews: This new site is like Airbnb for lovers of good design & architecture http://lptravel.to/lQAnFO 
travel;We just launched our Women Who Travel Facebook group. Join to discuss your passion for travel 👉 http://cntrvlr.co/7QyfowV 
travel;BUENA: The Only App You Need to Plan Your Weekend https://www.travel-break.net/travel-posts/best-travel-app-buena … via @StephBeTravel
travel;The best vacation spots in the world for couples http://cntrvlr.co/J3fOt8e 
travel;Sunset vibes from Aruba 🌞 #ArubaIDo #Aruba #onehappyisland @aruba
travel;via @LPtravelnews: WOW! #Reykjavik is going cycle-friendly with a bike hire scheme http://lptravel.to/Oi4mzU 
travel;Prague First Timers Guide - Great Things to Do and What Not to Miss Passing Thru http://sumo.ly/DW7A  via @betsywuebker
travel;This place is straight out of a story book 😍 Read more from my stay: http://buff.ly/2v9EIYD  @TongabeziZambia
travel;From safaris to stargazing, take in these gorgeous photos that mark this wildlife oasis.
technology;Lint Your Ruby Code with Overcommit and Static Analysis Tools:
technology;Orchparty: A DSL for Configuring Orchestration - https://github.com/jannishuebl/orchparty … (For generating docker-compose.yml files.)
technology;Hey, @ThatConference folks connect with me on @cardigan over the next couple days. #ThatConference #networking #makingfriends
technology;some days ago I learned about CTRL-A in Vim (incr number under cursor), I am surprised to find use cases here and there since then
technology;You don't even have to be on the number. It will increment the next number in the line. You can also do <C-x> to decrement.
technology;Listening to @bphogan give a great keynote this morning at @ThatConference
technology;A Few Tips to Improve the Speed of Your Test Suite
technology;Eventide: A Microservices and Event Sourcing Toolkit for Ruby - https://eventide-project.org/ 
technology;Building Crazy Queries with ActiveRecord and Arel
technology;A Look At How Ruby Interprets Your Code
technology;Testing for my KSP stream later and everything looks good! Launching rockets into space w/Ruby @ ~5PM MST.
technology;Is WEBrick Webscale?
technology;ICYMI Wed., I had a lot of fun with this post. Module refinements, profiling Enumerator, RSpec shared examples...
technology;The 37Signals people just seem so... *reasonable* about management.
news;Tesla’s Gigafactory keeps supercharging Reno: https://venturebeat.com/2017/08/08/teslas-gigafactory-keeps-supercharging-reno/ …
news;The Mondo+ revisits the Squeezebox but needs some help with its sound http://cnet.co/2wKmrhv 
news;These photos taken with a budget phone are nice for the price http://cnet.co/2vRoNih 
news;Declining LinkedIn recruiters' InMail blocks them from DM'ing you forever http://tnw.me/ARNLyy6 
news;Tesla said to be working on self-driving tech for electric semi truck http://tcrn.ch/2hKYxjj 
news;Sorry Snapchat, it’s time to say goodbye http://tnw.me/01Y6fpZ 
news;Love the storybot. Great going @YourStoryCo @SharmaShradha
news;Facebook takes on YouTube with Watch, its new episodic video service http://tnw.me/ooGCBiX 
news;How SoftBank’s $100B fund is in a league all its own
news;10 tips for better browsing with @MicrosoftEdge http://cnet.co/2vGpJ8C 
news;This 16-year-old has invented an #AI-based system to diagnose her grandfather’s eye disease. #Healthcare #HealthTech https://yourstory.com/2017/08/ai-system-kavya-kopparapu/?utm_source=TW&utm_medium=Post …
news;What should Sundar Pichai say to Googlers? http://cnet.co/2vR1MvI 
news;AR/VR Weekly: Social good dons a headset https://wp.me/p8wLEc-9uub  by @jason_wilson
news;See how your country’s internet speeds stack up in this new monthly global ranking http://tcrn.ch/2hLVg30 
travel;A Journey Through Jordan - a little travel story from me via @lonelyplanet's new Trips app ✈️✈️ #lptrips  https://trips.lonelyplanet.com/s/YHTpf4 
travel;Why Swimming Is the Ultimate Berlin Summer Pastime http://cntrvlr.co/xQxdBMm
travel;via @InsideTravelLab More Than Coffee: 7 of the Best Places Around the World for Literary Inspiration: https://www.insidethetravellab.com/best-places-for-literary-inspiration/ … … #Travel
travel;My 10 Essential #Travel Items - including my fav sunglasses from @sunglasswarehse #getoutthere
travel;Bangkok’s Most Expensive Street Food Is Totally Worth It
travel;Greetings from #Vail, #Colorado -- I just arrived this afternoon and I'm already falling for this town. It's like an Alpine wonderland! Mos…
travel;What is life but one big adventure?! #getoutthere @sunglasswarehse @ Colonial Zone, Dominican… https://www.instagram.com/p/BXlwhLWA8bD/ 
travel;The drive to Samaná Peninsula in northern Dominican Republic was fun and scenic, but the tolls… https://www.instagram.com/p/BXlv-mcARL7/ 
travel;Like fire and vikings? Head to remote #Shetland for the Up Helly Aa fire festival http://lptravel.to/J2A60R  by @LouiseBastock #travel
travel;Cheap and delicious food in SF http://ift.tt/2wJip91 
travel;Why your whole day in Copenhagen should be spent on this one street http://cntrvlr.co/o0jEhlu 
travel;In honor of #NationalBookLoversDay, add these #travelbooks to your reading list. 📚 -->  http://bit.ly/2hLLnmg 
travel;A local 17-year-old pilot offered to fly me over the city in a Cessna 172
travel;Make responsible travel a way of life. #Responsibletravel Better Places Travel @Breathedreamgo
technology;I firmly believe many places purposely develop a nerfed mobile web site just so they can push an app on me.
technology;GUI the Giraffe last year is succeeded by FIFO the Elephant this year. :D #ThatConference #JJKDevs
technology;Shifts in #tech adoption by a wider audience are enabled by one key factor: #Accessibility. http://trhou.se/2rAJ85z  via @treehouse_blog
technology;Tips I wish I’d known when learning to #code by @jcnordell http://trhou.se/2vzoSqJ  #productivity
technology;Learn how to install #Jupyter Notebooks, use them, and install kernels for other languages in this workshop: http://trhou.se/2u5Ehic 
technology;Check my @pluralsight #spark fundamentals sequel: Handling #FastData with @ApacheSpark! Structured Streaming covered https://www.pluralsight.com/courses/apache
technology;See how easy app-building can be with Laravel! Course author Hampton Paulk walks you through it:
technology;The latest Ember LTS release has enforced Data Down, Actions Up to the max extreme. This should be an interesting upgrade.
technology;From Form to Table With Laravel just launched! Watch now to build an app with this fast, reliable PHP framework: http://bit.ly/2uE0DCD 
technology;“What skills should a junior Ruby on Rails developer have?” by @k_kempinski
technology;Practice these soft skills to become a better designer, suggests @DellEMC Principal UX Designer @ian_armstrong
technology;Breaking down the principles of #machinelearning: http://ga.co/2v3KpGB  via @rpradeepmenon
technology;The biggest and most promising trends of web development this year: http://ga.co/2v3OBWJ  via @dash_bouquet @hackernoon
technology;What is the #Python programming language used for? http://trhou.se/2tpFksH 
news;So @Netflix bought a comic book company. Hopefully the shows based on those books will be better than Iron Fist. https://venturebeat.com/2017/08/07/netflix-acquires-comic-book-publisher-millarworld-run-by-self-styled-modern-day-stan-lee/ …
news;A copyright claim was reportedly used to stop ad blocking, but it's complicated http://gizmo.do/8UIDFh8 
news;How @PlayabloNow is making #learning fun for #children and young adults. #edtech #startup #apps https://yourstory.com/2017/08/playablo-learning/?utm_source=TW&utm_medium=Post …
news;The best smart TV system in an affordable 4K TV http://cnet.co/2wS25D3 
news;Now that SoundCloud has funding, it's time to ditch its weak Spotify competitor Go+, focus on indie musicians & DJs
news;Microsoft shares its vision to become AI industry-leader http://tnw.me/Dv2DCsY 
news;Before an A380 flies, it's driven across southern France http://cnet.co/2vYFwAh 
news;FBI says ISIS smuggled funds to US using eBay and PayPal http://tnw.me/BHTI1T4
news;How to restore deleted @Google contacts http://cnet.co/2vYErrV 
news;What looks like an immovable tapestry of glittering stars is really so much more
news;Here Be Dragons AR/VR studio gets $10 million funding from Discovery Communications https://wp.me/p8wLEc-9uEJ  by @UploadVR
news;8 mildly interesting things we learned about Pirate Bay's Peter Sunde http://tnw.me/YSNJqyn 
news;Five years ago, passwords never appeared weaker...
news;How to put your old phone to new use http://cnet.co/2vYA8wL 
travel;For those fortunate to be able to take a gap year, it can be a life-changing experience
travel;This new flight deal website is perfect for impulsive travelers http://cntrvlr.co/8tJ0Qn6
travel;Happy #WorldElephantDay! Retweet and let’s help conserve and protect elephants from the numerous threats they face. #NatGeoAfrica
travel;On #WorldElephantDay we say a big thank you to all of the men & women who serve on the #frontline everyday to protect these majestic animals
travel;The latest The Transformational Travel Daily! http://paper.li/Breathedreamgo/1495803743?edition_id=723dde00-7f5e-11e7-9cf0-0cc47a0d164b … Thanks to @Emmalcharlton @Sbrasheed @lisavold1 #travel #ttot
travel;The Most Beautiful Botanical Gardens in the U.S. http://cntrvlr.co/NW7Cfiw 
travel;You haven't heard of these travel apps, but downloading them will be the best thing you've ever done http://cntrvlr.co/622zisx 
travel;Photo of the Day: Street in the Sky http://on.natgeo.com/2uA6eLh  #photography #pod
travel;The open road stretches out before you; you have your map, a f... More for Sagittarius http://bit.ly/yibOac 
travel;Want to start doing more catch ups whenever we travel to new cities! Follow our FB community to find out when/where our next one will be 👍🏼
travel;#Travel like a #travelwriter: How to find the best of a new city! http://gigigriffis.com/how-do-travel-writers-find-the-best-of-a-new-city-or-country/ … #ttot #alwaysgo #mytinyatlas
travel;Here's our best advice for seeing animals in their native habitats in the best, most ethical way
travel;Short stay in #Dubai? Here's our tips on how to spend a perfect day http://lptravel.to/cxnNoc  #travel
travel;Getting high in The Rockies https://breathedreamgo.com/the-rockies-icefields-parkway-alberta/?utm_source=ReviveOldPost&utm_medium=social&utm_campaign=ReviveOldPost … #lp #NGTradar #TTOT #solotravel
technology;Taking My Career to the Next Level: How I Became a #Developer: http://trhou.se/2o08Faz 
technology;The goal is to help each other learn Machine Learning and ask questions.  Trying to gauge interest and wouldn't start for a little bit.
technology;Looking to start a Programming Book Club to learn Machine Learning.  We would meet once a month or so. Let me know if you're interested.
technology;Treehouse CEO and founder @ryancarson learned how to code with a Dummies Book on #HTML. How did you first learn how to code?
technology;Treehouse teacher @sketchings shares her top 5 tips for productive #learning: http://trhou.se/2rarfxV 
technology;Accelerate your learning with real-time, one-on-one help. How to find a Pluralsight mentor that can help you grow: http://plrsig.ht/2tf4rye 
technology;Today we're launching Desktop Kit. A design resource filled with Sketch templates of GUI elements found in macOS https://buff.ly/2vMkS3f 
technology;Learn how to animate your React app with this wonderful new course.
technology;Take a look at what @altair_us is doing with @netbeans: https://jaxenter.com/netbeans/fluxmotor-predesign-electric-motors-netbeans-platform … #Altair technology on Java and NetBeans!
technology;Learn the basics of #Android #development w/ @BenDeitch and build an app to serve up facts with the tap of a button: http://trhou.se/2wIkrGy 
technology;Join the 4 MILLION learners on Code School and learn how to code for free this weekend: https://www.codeschool.com/free-weekend 
technology;How to Choose a #Programming Language: http://trhou.se/1rmB2fP  by @astuteape
technology;Why investing in your employees’ skills matters now more than ever
technology;How machines like Amazon’s Alexa are learning to process language with the help of 3-D virtual games: http://ga.co/2uxlTel  @techreview
news;Google Home now works with Spotify free accounts http://tcrn.ch/2vPwMJW  by @lucasmtny
news;NASA is using Intel’s deep learning to find better landing sites on the moon http://tcrn.ch/2whelRe  by @bheater
news;Food scientists have invented all-in-one sugar cream pods for your coffee http://gizmo.do/wBuSp5J 
news;Bing is 'Bigger Than You Think', Says Microsoft http://bit.ly/2uYwXBp 
news;Google to livestream Android O launch event timed for total solar eclipse http://tcrn.ch/2xbeTVa  by @etherington
news;@nriPropadis helps #NRIs maintain their properties back home in a hassle-free way. #startups #realestate https://goo.gl/TAWqrQ 
news;Android O is O-fficially launching August 21 http://arstechnica.com/gadgets/2017/08/android-o-is-o-fficially-launching-august-21/ … by @RonAmadeo
news;iOS 11 is quite the game-changer for iPad owners http://tcrn.ch/2fRoEo5 
news;Apple and Hollywood said to continue talks around early digital movie rentals http://tcrn.ch/2xbtHTI  by @etherington
news;Hands on with Andy Rubin’s Essential Phone http://tcrn.ch/2uPgyTS 
news;Amazon's 'Galaxy Quest' reboot has a new writer http://cnet.co/2whc1tJ 
news;A Bluetooth 'gaming fidget spinner' was always the only way this ends http://gizmo.do/hHPM4wZ 
news;Facebook will now bury clickbait video and fake 'play' buttons http://tnw.me/Rw4Bmks 
news;Darmiyan's software detects early stages of Alzheimer’s https://wp.me/p8wLEc-9veb  by @bmagistretti
travel;Ha, found a travel blogger ripping off one of my blog posts. They're sharing same info as me and just so happened to also include my typo.
travel;Bride sues American Airlines for ruining her wedding dress with red wine http://cntrvlr.co/TyIaR31 
travel;Photo of the Day: Graduation Celebration http://on.natgeo.com/2icBIoX  #pod
travel;Been an exhausting week? Where to go next month for relaxation http://lptravel.to/S2QkGk  #travel
travel;Open your eyes to this well-kept secret of Slovenia where gorgeous rolling pastures meet charming farms and villages
travel;6 great last-minute Labor Day weekend getaways http://cntrvlr.co/xuwyehA 
travel;The Ultimate USA Fall #Travel Guide for Your Next Vacation http://travelthroughlife.net/usa-fall-travel/ … via @travthroughlife
travel;Jamming as we drive with our very own Lonely Planet #EpicDrives playlist! https://open.spotify.com/user/lonely_planet/playlist/6ikBmvGVcFm06mJnVBblAy …
travel;Why Bristol is My New Favourite City in the UK https://whatsdavedoing.com/bristol-favourite-city/ … via @driftingkiwi
travel;No matter what type of traveler you are, @TravelLeisure has a national park for you! 
travel;Thanks to @Cision for asking me some great questions in this interview about being a blogger!  #travel #blogging #DigitalMarketing
travel;How many of 2017's must-sees have you seen so far? http://bit.ly/2hdJAFn  #travelin2017 #travel
